{
  "manifest_version": "1.0.0",
  "manifest_id": "MANIFEST-OFFICIAL-PENDING",
  "created_at": "2026-09-06T12:00:00Z",
  "cohort_name": "Official Ground Truth Cohort (Pending Dataset)",
  "protocol_version": "1.0.0",
  "description": "Official Ground Truth manifest placeholder. Currently empty pending acquisition of approved physical Ground Truth dataset.",
  "is_synthetic_manifest": false,
  "records": []
}
