{
  "manifest_version": "1.0.0",
  "manifest_id": "MANIFEST-TEMPLATE-COHORT",
  "created_at": "2026-09-06T12:00:00Z",
  "cohort_name": "Ground Truth Cohort Template",
  "protocol_version": "1.0.0",
  "description": "Clean template manifest for registering empirical Ground Truth trials. Contains no fabricated scientific results.",
  "is_synthetic_manifest": false,
  "records": [
    {
      "sample_id": "GT-TEMPLATE-001",
      "video_path": "data/ground_truth/raw/freestyle/template_video.mp4",
      "video_sha256": "0000000000000000000000000000000000000000000000000000000000000000",
      "stroke": "Freestyle",
      "participant_id": "PARTICIPANT-TEMPLATE-001",
      "session_id": "SESS-TEMPLATE-2026",
      "annotation_file": "data/ground_truth/annotations/template_annotation.json",
      "annotation_status": "COMPLETE",
      "quality_status": "PASSED",
      "inclusion_status": "INCLUDED",
      "exclusion_reason": null,
      "split": "VALIDATION_OFFICIAL",
      "validator_version": "1.0.0"
    }
  ]
}
